title,updateTimestamp,content,relatedStocks,relatedInfos,date,trade_date
人民币兑美元中间价报7.1025 调升3个基点,2024-04-17 09:16:44,格隆汇4月17日｜人民币兑美元中间价报7.1025，上调3点；上一交易日中间价7.1028，上一交易日官方收盘价7.2396，上日夜盘报收7.2380。,CNH,,2024-04-17 01:16:44,20240418
,2024-04-17 11:19:51,格隆汇4月17日｜离岸人民币1个月HIBOR上升至5.105%，接近2018年以来最高水平。,CNH,,2024-04-17 03:19:51,20240418
,2024-04-17 16:32:47,格隆汇4月17日｜在岸人民币兑美元收盘报7.2349，较上一交易日上涨47点。,CNH,,2024-04-17 08:32:47,20240418
,2024-04-18 06:11:36,格隆汇4月18日｜在岸人民币兑美元北京时间03:00收报7.2383，较上一交易日夜盘收盘跌3点。成交量458.56亿美元。,CNH,,2024-04-17 22:11:36,20240418
离岸人民币兑美元较周二纽约尾盘涨204点,2024-04-18 06:15:13,格隆汇4月18日｜离岸人民币（CNH）兑美元北京时间04:59报7.2440元，较周二纽约尾盘涨204点，盘中整体交投于7.2685-7.2425元区间。,CNH,,2024-04-17 22:15:13,20240418
