title,updateTimestamp,content,relatedStocks,relatedInfos,date,trade_date
,2024-02-23 09:16:43,格隆汇2月23日｜人民币兑美元中间价报7.1064，调贬46个基点。,CNH,,2024-02-23 01:16:43,20240224
香港交易所于3月29日起将货币期货及期权纳入衍生产品假期交易,2024-02-23 12:35:56,格隆汇2月23日｜香港交易及结算所有限公司今天（星期五）宣布，旗下所有货币期货及期权将于2024年3月29日起纳入衍生产品假期交易的合资格产品名单。将纳入衍生产品假期交易的货币产品包括：美元、欧元、澳元、日元、印度卢比兑人民币（香港）的期货及期权交易。香港交易所集团新兴业务、定息及货币业务主管苏盈盈表示：我们很高兴宣布衍生产品假日交易的扩容安排，纳入我们市场上广受欢迎的货币期货及期权产品，以便投资者在香港公众假期时仍可进行外汇风险管理。,CNH,,2024-02-23 04:35:56,20240224
港交所：3月29日起货币期货及期权纳入衍生产品假期交易,2024-02-23 14:43:05,格隆汇2月23日｜港交所(0388.HK)宣布，旗下所有货币期货及期权将于今年3月29日起纳入衍生产品假期交易的合资格产品名单。将纳入衍生产品假期交易的货币产品包括: 美元兑人民币(香港)期货；小型美元兑人民币(香港)期货；美元兑人民币(香港)期权；欧元兑人民币(香港)期货；澳元兑人民币(香港)期货；日元兑人民币(香港)期货；印度卢比兑人民币(香港)期货；印度卢比兑美元期货；人民币(香港)兑美元期货。,CNH,,2024-02-23 06:43:05,20240224
,2024-02-23 16:32:14,格隆汇2月23日｜在岸人民币兑美元2月23日16:30收盘报7.1984，较上一交易日下跌125点。,CNH,,2024-02-23 08:32:14,20240224
国家外汇局：2024年1月银行结汇14515亿元人民币，售汇15216亿元人民币,2024-02-23 17:03:17,格隆汇2月23日丨国家外汇管理局统计数据显示，2024年1月，银行结汇14515亿元人民币，售汇15216亿元人民币。按美元计值，2024年1月，银行结汇2043亿美元，售汇2141亿美元。2024年1月，银行代客涉外收入42389亿元人民币，对外付款41999亿元人民币。按美元计值，2024年1月，银行代客涉外收入5965亿美元，对外付款5910亿美元。,CNH,,2024-02-23 09:03:17,20240224
两部门：深化外汇领域改革开放，促进跨境贸易和投融资便利化,2024-02-23 17:13:17,格隆汇2月23日｜中国人民银行、国家外汇局召开2024年全面从严治党暨纪检监察工作会议。朱鹤新指出，国家外汇局系统要深化外汇领域改革开放，促进跨境贸易和投融资便利化，着力提升资本项目开放的质量，防范化解外部冲击风险，维护外汇市场稳定和国家经济金融安全，保障外汇储备资产安全、流动和保值增值。,CNH,,2024-02-23 09:13:17,20240224
,2024-02-24 06:12:41,格隆汇2月24日｜在岸人民币兑美元北京时间03:00收报7.1953，较上一交易日夜盘收盘跌16点。成交量272.23亿美元。,CNH,,2024-02-23 22:12:41,20240224
,2024-02-24 06:13:06,格隆汇2月24日｜离岸人民币（CNH）兑美元北京时间05:59报7.2053元，较周二纽约尾盘跌32点，盘中整体交投于7.2143-7.1987元区间。,CNH,,2024-02-23 22:13:06,20240224
