title,updateTimestamp,content,relatedStocks,relatedInfos,date,trade_date
7.1312，人民币兑美元中间价贬至2023年11月21日以来最低,2024-07-03 09:16:24,格隆汇7月3日｜人民币兑美元中间价较上日调降21点至7.1312，中间价贬值至2023年11月21日以来最低。,CNH,,2024-07-03 01:16:24,20240704
离岸人民币兑美元触及7.31 续创阶段新低,2024-07-03 09:52:04,格隆汇7月3日｜离岸人民币兑美元最低触及7.31，续创去年11月以来新低。,CNH,,2024-07-03 01:52:04,20240704
离岸人民币兑美元跌破7.31关口,2024-07-03 10:49:08,格隆汇7月3日｜离岸人民币兑美元跌破7.31关口至7.3113，创2023年11月3日以来新低。,CNH,,2024-07-03 02:49:08,20240704
中信证券：预计后续央行稳汇率政策有望保持强度,2024-07-03 11:00:22,"格隆汇7月3日｜今日早盘，离岸人民币对美元汇率跌至7.31元关口。Wind数据显示，截至10:50，离岸人民币对美元汇率报7.3105元，较前收盘价跌25基点，盘中最低报7.3115元；在岸人民币对美元汇率报7.2734元，较前收盘价跌20基点，盘中最低报7.2736元，均创去年11月中旬以来新低。
中信证券研报认为，2024年一季度，我国国际收支延续“一顺一逆”格局。各账户变动显示出外部因素使得人民币继续面临被动贬值压力，同时内部因素可起到一定的托底作用。往后看，人民币更为重要的支撑或在于央行稳汇率工具的强度；预计后续央行稳汇率政策有望保持强度，人民币汇率虽有压力，但贬值空间有限，突破前高的概率不大。",CNH,,2024-07-03 03:00:22,20240704
离岸人民币跌破7.31关口，什么情况？未来走势如何？,2024-07-03 12:29:17,"格隆汇7月3日｜据一财，离岸人民币对美元跌破7.31关口，盘中最低报7.3115；在岸人民币对美元报7.2734元，盘中最低报7.2736元，均创去年11月中旬以来新低。数据显示，今年以来，离岸、在岸人民币对美元累计下跌2.6%、2.56%。
东方金诚首席宏观分析师王青表示，近期离岸人民币对美元汇价波动下行，主要原因是伴随美联储推迟降息预期升温，以及美国经济基本面持续强于欧洲和日本，6月以来美元指数走高，由此导致人民币对美元被动贬值。中信证券表示，往后看，人民币更为重要的支撑或在于央行稳汇率工具的强度；预计后续央行稳汇率政策有望保持强度，人民币汇率虽有压力，但贬值空间有限，突破前高的概率不大。",CNH,,2024-07-03 04:29:17,20240704
日本时隔20年发行新版纸币,2024-07-03 14:07:07,格隆汇7月3日丨据CCTV国际时讯，日本央行7月3日发行新版日元纸币，新版日元纸币三种面值，分别为一万日元、五千日元与一千日元。新版一万日元印有被称为“近代日本经济之父”的涩泽荣一，新版五千日元印有日本近代女子教育家津田梅子，新版一千日元印有日本近代医学家北里柴三郎。新版纸币采用全息技术印制，旧版纸币也可继续使用。据日本共同社报道，3日当天计划发出1.6万亿日元（约合人民币720亿元）的新版纸币。据悉，财务省2019年4月公布了全面更新纸币的计划，到正式发行总共用了5年零3个月进行准备。日本上一次更新纸币是在2004年11月。,CNH,,2024-07-03 06:07:07,20240704
,2024-07-03 16:31:30,格隆汇7月3日｜在岸人民币兑美元北京时间16:30官方收报7.2734，较上一交易日官方收盘价跌20点，较上日夜盘收盘跌22点。,CNH,,2024-07-03 08:31:30,20240704
,2024-07-04 06:19:51,格隆汇7月4日｜在岸人民币兑美元北京时间03:00收报7.2699，较上一交易日夜盘收盘涨13点。成交量213.52亿美元。,CNH,,2024-07-03 22:19:51,20240704
,2024-07-04 06:23:39,格隆汇7月4日｜离岸人民币（CNH）兑美元北京时间04:59报7.3032元，较周二纽约尾盘涨38点，盘中整体交投于7.3114-7.2920元区间。,CNH,,2024-07-03 22:23:39,20240704
