title,updateTimestamp,content,relatedStocks,relatedInfos,date,trade_date
,2024-03-19 12:25:45,格隆汇3月19日｜日本10年期国债收益率下跌3个基点至0.725%；欧元兑日元EUR/JPY上涨超过0.5%，达到163.00。,EUR,,2024-03-19 04:25:45,20240320
欧盟计划对俄罗斯的谷物征收关税,2024-03-19 13:04:10,格隆汇3月19日｜据英国金融时报，欧盟正准备对从俄罗斯和白俄罗斯进口的谷物征收关税，以安抚农民和一些成员国。这是自俄乌冲突以来，欧盟首次对食品产品施加限制。长期以来，欧盟一直在抵制来自波兰和波罗的海国家要求限制俄罗斯和白俄罗斯进口的压力，认为此举可能扰乱全球食品市场，损害发展中国家。但据知情人士透露，预计欧盟委员会将在未来几天对来自俄罗斯和白俄罗斯的谷物征收每吨95欧元的关税。知情人士表示，这将使价格至少上涨50%，从而消除需求。它还将对油籽及其衍生产品征收50%的关税。,EUR,,2024-03-19 05:04:10,20240320
美元指数在美联储决议声明前夕涨超0.2%，日元在日本央行结束YCC当天跌超1.1%,2024-03-20 06:21:30,格隆汇3月20日｜周二（3月19日）纽约尾盘，ICE美元指数涨0.23%，报103.820点。彭博美元指数涨0.23%，报1240.63点，日内交投区间为1237.31-1242.86点。美元兑日元上涨1.14%，报150.85点。欧元兑美元跌0.08%全天V型走势最低触及1.0835，英镑兑美元跌0.06%全天V型走势最低触及1.2668，美元兑瑞郎大致持平。,EUR,,2024-03-19 22:21:30,20240320
,2024-03-20 07:47:02,格隆汇3月20日｜欧元兑日元升至163.955，创下去年11月以来的最高水平。,EUR,,2024-03-19 23:47:02,20240320
日元兑欧元跌至2008年以来最低水平,2024-03-20 08:21:12,格隆汇3月20日｜受市场对日本央行政策押注影响，日元兑欧元跌至2008年以来最低水平。日元兑美元短线走低，目前报151.32。昨日，日本央行历史性转变，结束负利率和YCC政策，取消对日股ETF和Reits的购买。,EUR,,2024-03-20 00:21:12,20240320
