title,updateTimestamp,content,relatedStocks,relatedInfos,date,trade_date
欧/美小幅回升，市场等待欧洲央行决议,2024-04-11 12:40:15,格隆汇4月11日｜欧元/美元昨日跌超1%，收报1.0741，此前美国CPI升幅超预期令美债收益率走高。由于美债收益率从纽约收盘水平回落，欧元/美元在亚洲早盘一度升至1.0749附近。目前焦点转向欧洲央行利率决议，市场普遍预计利率不会发生变化，人们将关注其前瞻指引以及欧洲央行是否发出6月宽松的信号。欧元/美元支撑位在2月14日低点1.0695，1.0700前预计会有买盘，阻力位在10日均线1.0819，若突破将缓解压力。,EUR,,2024-04-11 04:40:15,20240412
,2024-04-11 20:23:31,格隆汇4月11日｜欧元兑美元EUR/USD跌至2月14日以来最低水平，日内跌0.2%。,EUR,,2024-04-11 12:23:31,20240412
小摩：很难找到做空美元的理由 ,2024-04-11 21:11:33,格隆汇4月11日｜摩根大通全球外汇策略主管Samuel Zief说，由于美国和欧元区货币政策的前景存在分歧，很难找到做空美元的理由。他在欧洲央行维持利率不变后表示:“虽然美国的通胀可能会让美联储有一些按兵不动的理由，但欧洲央行实际上对其通胀前景越来越有信心。”他认为欧洲央行不降息的门槛相当高。Zief说，美国通胀上升的消息看来将主导外汇市场，摩根大通倾向于做多美元。,EUR,,2024-04-11 13:11:33,20240412
美元指数短线反弹,2024-04-11 21:39:45,格隆汇4月11日｜美元指数DXY短线反弹10余点，现报105.14；非美货币回落，英镑兑美元GBP/USD、欧元兑美元EUR/USD短线均回落逾10点。,EUR,,2024-04-11 13:39:45,20240412
美元指数大致持平，日元跌向154点,2024-04-12 06:21:58,格隆汇4月12日｜周四（4月11日）纽约尾盘，ICE美元指数涨0.02%，报105.265点。彭博美元指数涨0.06%，报1250.83点，日内交投区间为1249.06-1253.67点。美元兑日元涨0.05%，报153.24点，09:09（亚太早盘）跌至日低152.76点，美国PPI数据出炉后下探152.80点，随后在23:30涨至153.32点，逼近1990年6月28日顶部154.65点，当年4月17日曾达到160.20点。欧元兑美元跌0.14%，英镑兑美元涨0.12%，美元兑瑞郎跌0.32%，澳元兑美元涨0.41%，纽元兑美元涨0.40%，美元兑加元涨0.05%。,EUR,,2024-04-11 22:21:58,20240412
