title,updateTimestamp,content,relatedStocks,relatedInfos,date,trade_date
,2024-01-29 16:57:17,格隆汇1月29日｜欧元兑瑞郎跌0.5%至0.9328，为1月15日以来最低。,EUR,,2024-01-29 08:57:17,20240130
,2024-01-29 17:46:29,格隆汇1月29日｜欧元兑英镑跌至五个月低点，最新跌0.3%至0.8521。,EUR,,2024-01-29 09:46:29,20240130
欧洲央行或将提前降息，欧元承压,2024-01-29 20:19:13,格隆汇1月29日｜欧洲政府债券周一上涨，而欧元下跌，因为对欧洲央行将提前降息的猜测越来越多。法国巴黎银行策略师Sam Lynton-Brown表示，欧洲央行4月降息的时机已经成熟。从市场角度来看，风险倾向于在更早的3月降息，或首次降息50个基点。但欧洲央行行长拉加德委婉地表示，欧洲央行可能会从2024年年中左右开始降息。欧洲央行管委Kazimir也发出谨慎的信号：即将公布的数据和欧洲央行3月份的经济预测将指导他们的决定。但市场也有意忽略这些警告。Ostrum资管市场策略主管Axel Botte表示，从某种意义上说，欧洲央行的信息令人感到困惑，不过，管委会内部缺乏一致意见为提前降息敞开了大门。,EUR,,2024-01-29 12:19:13,20240130
,2024-01-29 23:23:37,格隆汇1月29日｜欧元兑美元EUR/USD日内走低0.50%，现报1.0799。,EUR,,2024-01-29 15:23:37,20240130
机构：即将公布的数据或令欧元承压,2024-01-29 23:24:07,格隆汇1月29日｜BDSwiss中东和北非地区CEO Daniel Takieddine表示，欧元兑美元继续面临下行压力，这反映出欧元区的经济风险。周二将公布的欧元区第四季度GDP初值预计将为欧元区经济状况提供线索。数据发布可能会造成一些波动，并可能影响欧元的表现。周四发布的欧元区1月份通胀预估数据也可能打压市场情绪，并可能影响有关货币政策方向的预期。,EUR,,2024-01-29 15:24:07,20240130
