title,updateTimestamp,content,relatedStocks,relatedInfos,date,trade_date
市场分析：英国大选不会引发“买消息卖事实”交易,2024-07-04 12:50:24,"格隆汇7月4日｜分析师Andrew Spencer表示，市场在周四英国大选前净看多英镑，但大选结果不太可能引发“买消息，卖事实”的交易，因为一个稳定的新政府应该会提供逢低买进的需求。市场预计工党将在议会获得绝对多数的地位，得以推行其中左翼政策，但这些政策需要时间来影响经济。调仓将是市场对大选作出的一个主要反应，IMM最新数据显示，截至6月25日，英镑多头合约从47,621口下滑至44,048口，虽然多头势大，但并不极端。欧盟是英国最大的客户，而工党反对英国脱欧，因此虽然没有机会重新加入欧盟，但建立更紧密的关系和减少企业监管冲突是可预期的，这将支撑英镑。周三低点1.2679和上周低点1.2613是初步支撑位，而昨日高点1.2776 和6月高点1.2859是首道阻力位。",GBP,,2024-07-04 04:50:24,20240705
德商银行：预计英镑对英国大选反应冷淡,2024-07-04 15:27:37,格隆汇7月4日丨随着英国大选投票开始，英镑兑美元上涨，但兑欧元持平。德国商业银行外汇分析师Michael Pfister表示，除非出现完全不可预见的情况，否则工党很可能轻松赢得选举。因此，英镑对选举结果的反应可能比较温和。只有两种可能出现问题的结果，一种是工党以压倒性优势获胜，导致市场紧张，另一种是右翼的英国改革党赢得的选票明显超过预期。,GBP,,2024-07-04 07:27:37,20240705
市场分析：英镑的大部分波动将出现在出口民调公布时,2024-07-04 15:34:37,格隆汇7月4日｜市场分析师Justin McQueen表示，鉴于民调一直显示工党将获得历史性的多数席位，因此预计英国大选初步结果对英镑的影响要比近几次大选温和得多。英镑的大部分变动预计将出现在出口民调公布时（北京时间05:00）。根据过往4次选举时点的统计，在出口民调之后，英镑的平均波幅约为250点。考虑到此次选举的不确定性小，英镑的波幅可能会远低于平均水平。货币政策前景仍是英镑的关键驱动因素。长期来看，英镑兑欧元有可能表现良好，因为工党希望与欧盟建立更紧密的联系。,GBP,,2024-07-04 07:34:37,20240705
英国央行8月降息预期增加 通胀压力缓解令英镑承压,2024-07-04 18:09:22,格隆汇7月4日｜受到英国央行货币政策委员会成员密切关注的英国央行决策者小组的最新调查证实，通胀压力正在缓解，这增加了8月份降息的可能性。英国1年通胀预期下降0.1个百分点至2.8%，从而将3个月平均水平从3%拉低至2.9%。预期工资增长率从4.1%下滑至4%，创下周期新低，使3个月平均值下降0.3个百分点，至4.2%。无论如何，该报告进一步加大了英国央行政策制定者的言论将倾向鸽派的风险，从而令英镑承压。,GBP,,2024-07-04 10:09:22,20240705
美元指数跌超0.2%，日元、欧元、加元涨约0.2%,2024-07-05 06:10:42,格隆汇7月5日｜周四（7月4日）纽约尾盘，ICE美元指数下跌0.25%，报105.137点。彭博美元指数跌0.26%，报1262.58点。亚洲货币中，美元兑日元跌0.25%，报161.28，北京时间09:00前后疑似出现一波与日本当局干预相关的显著下挫，整体上持稳于7月3日涨至的161.95附近。欧元兑美元涨0.23%，英镑兑美元涨0.14%，美元兑瑞郎跌0.16%；商品货币对中，澳元兑美元涨0.3%，纽元兑美元涨0.23%，美元兑加元跌0.2%。,GBP,,2024-07-04 22:10:42,20240705
