title,updateTimestamp,content,relatedStocks,relatedInfos,date,trade_date
美元兑日元向上触及157,2024-04-30 09:56:32,格隆汇4月30日｜美元兑日元USD/JPY向上触及157，日内涨0.44%。,JPY,,2024-04-30 01:56:32,20240501
分析师：日本是否干预汇市 该国央行周二晚间的数据或助于释疑,2024-04-30 13:54:28,格隆汇4月30日｜日本央行周二晚间将发布5月1日经常帐余额的预估，这可能有助于解开当局昨日是否干预汇市的谜团。如果日央行预测余额减少的幅度，远远大于周一疑似干预前民间机构的预估，就可能代表政府已买入日元。日本经济研究机构Totan Research上周估计，由于政府债券发行等财政因素，日本央行的经常帐余额将减少2.1万亿日元。Central Tanshi预测将减少2.05万亿日元。外汇交易在两个工作天内结算，因此，如果日本央行周一买入日元，这将反映在周三的数据中。Totan Research分析师Yuichiro Takai说，如果减少的幅度大大超过预期，毫无疑问当局买进了日元。,JPY,,2024-04-30 05:54:28,20240501
,2024-04-30 17:51:50,格隆汇4月30日｜日本前高级外汇外交官员Furusawa：日本政府极有可能在周一干预以支撑日元。,JPY,,2024-04-30 09:51:50,20240501
日本财务省公布最新干预数据：0日元,2024-04-30 18:00:40,格隆汇4月30日｜日本财务省公布最新外汇干预操作，3月28日-4月25日总干预金额为0日元。值得注意的是，该数据并未包含29日（周一）的情况。日本央行数据显示，4月29日外汇干预总额可能为5.51─5.26万亿日元。,JPY,,2024-04-30 10:00:40,20240501
日本周一或出手干预汇市 干预规模约为5.5万亿日元,2024-04-30 18:17:39,格隆汇4月30日｜根据对日本央行账户的分析，日本很可能在周一进行了自2022年以来的首次货币干预。日本央行周三报告称，其经常账户可能减少7.56万亿日元，比经纪商估计的约2.1万亿日元的降幅要大得多，表明发生了约5.5万亿日元的干预。在经过数周的口头干预后，日元兑美元周一迅速贬值至160以上。财务省拒绝证实是否进行了干预，这表明它更愿意让交易商猜测。Totan Research上周估计，日本央行的经常账户余额将减少2.1万亿日元。Central Tanshi预测为减少2.05万亿日元。外汇交易将在两个工作日内结算，因此如果日本央行在周一用美元买入日元，这将反映在周三的市场数据中。,JPY,,2024-04-30 10:17:39,20240501
,2024-04-30 20:09:38,格隆汇4月30日｜美元兑日元USD/JPY日内涨幅扩大至0.50%，现报157.10。,JPY,,2024-04-30 12:09:38,20240501
,2024-04-30 20:15:09,格隆汇4月30日｜日元跌0.5%至盘中低点1美元兑157.13。,JPY,,2024-04-30 12:15:09,20240501
芝商所：周一日元现货交易量创2016年以来新高 ,2024-04-30 21:30:00,格隆汇4月30日｜据芝商所称，本周一是2016年11月以来日元现货交易最繁忙的一天。交易所一位代表在电子邮件中说，在CME的EBS现货平台上，美元兑日元的交易量超过了770亿美元，而上周五的交易量为310亿美元。大部分交易活动（约637亿美元）发生在伦敦时间上午9点（北京时间下午4点）之前。日元周一大幅波动，兑美元汇率从34年来的最低水平反弹。日本央行数据显示，日本当局自2022年以来首次出手干预支撑日元，干预规模约为5.5万亿日元。,JPY,,2024-04-30 13:30:00,20240501
美银：日本预计将限制外汇干预力度以维持储备,2024-04-30 22:31:35,"格隆汇4月30日｜美国银行的Shusuke Yamada和Izumi Devalier在一份报告中称，日本财务省今年的外汇干预规模不太可能超过 3,270亿美元。该数值是他们对日本1.3万亿美元外汇储备中存款和短期证券所占份额的估计。他们说，如果日元兑美元贬值超过170，干预力度可能会加大。日本当局“可能不希望外汇储备降至1万亿美元以下，因为这会产生心理影响”。日本政府尚未正式确认昨天日元兑美元走强时进行了干预。",JPY,,2024-04-30 14:31:35,20240501
ICE美元指数4月份累涨超1.7%，日元累跌约4.2%下探160关口,2024-05-01 06:18:36,"格隆汇5月1日｜周二（4月30日）纽约尾盘，ICE美元指数涨0.67%，报106.289点，日内交投区间为105.635-106.345点，逼近4月16日顶部106.517点和2023年11月1日顶部107.113点，4月份累计上涨1.73%。彭博美元指数涨0.60%，报1265.88点，逼近4月19日顶部1271.06点和2023年11月1日顶部1279.07点，4月份累涨1.65%。
亚洲货币中，美元兑日元涨0.86%，报157.70，4月份累涨4.19%，4月29日曾涨至160.17。欧元兑美元跌0.48%、4月份累跌1.12%，英镑兑美元跌0.57%、4月份累跌1.02%，美元兑瑞郎涨0.95%、4月份累涨1.96%；商品货币对中，澳元兑美元跌1.38%、4月份累跌0.69%，纽元兑美元跌1.42%、4月份累跌1.48%，美元兑加元涨0.84%、4月份累涨1.74%。",JPY,,2024-04-30 22:18:36,20240501
摩根大通全球外汇策略联席主管：日元兑美元“脱锚”跌幅不超过5%,2024-05-01 06:22:34,格隆汇5月1日｜摩根大通全球外汇策略联席主管Meera Chandan表示，鉴于日本央行缺少行动，日元处于相当不稳定的区域。“如果市场调整对美联储的预期，最后30个基点的降息预期也被拿掉的话，美元-日元可以轻松上涨3%至5%，”她周二接受采访时表示。“如果日元疲软对日本来说确实是政策关切，那么他们就需要改变货币政策，而他们选择不这样做的事实为进一步走软开了绿灯，”Chandan表示。本周的美国数据和美联储会议将决定美国收益率走势。,JPY,,2024-04-30 22:22:34,20240501
