title,updateTimestamp,content,relatedStocks,relatedInfos,date,trade_date
,2024-03-22 09:44:23,格隆汇3月22日｜美元兑日元USD/JPY升至151.84的四个月高点。,JPY,,2024-03-22 01:44:23,20240323
“日元先生”：日本央行已完成今年剩余时间内的加息,2024-03-22 11:07:00,格隆汇3月22日｜前日本高级外汇官员榊原英资表示，日本央行可能会在2024年剩余时间里保持利率不变，并等待通胀如何演变。他表示，今年不会有进一步的加息，日本央行已经做到了，他们将在未来一段时间内保持这种状态。而如果美/日上升到155-160，官员们可能会干预，“干预有时是必要和有效的”，这取决于事件的原因。对于日本的政策制定者来说，2%或3%的通胀率是可以接受的，因为轻微的通胀比通缩要好。一旦开始采取激进的措施，比如加息，就需要仔细监控，然后你可能会考虑采取额外的行动。,JPY,,2024-03-22 03:07:00,20240323
人民币在岸、离岸汇率双双创下四个月新低，发生了什么？,2024-03-22 16:51:56,格隆汇3月22日｜据一财，3月22日，人民币对美元汇率离岸、在岸双双跌破重要点位，创下近四个月以来的新低。汇管信息科技研究院副院长、对外经贸大学金融学院兼职教授赵庆明对记者表示，近期人民币汇率的剧烈波动，主要是外部原因诱发。近期非美货币比较弱，以日元为例，日本加息之后，日元不涨反跌，触及近两年的低位，这种情况带崩了其他周边货币，人民币也算在其中。另一方面，今日人民币开盘价较之以往下跌幅度增大，随后外围市场先下跌，在岸人民币市场也随之迅速走弱，这算是预期实现。,JPY,,2024-03-22 08:51:56,20240323
离岸对冲基金止损盘触发，人民币短线急跌500点,2024-03-22 16:54:54,格隆汇3月22日｜据一财，巴克莱中国利率、外汇策略师张蒙表示：“初始触发人民币贬值的因素应该是隔夜美元对所有货币的强势走势。此外，人民币中间价也存在一定影响，市场正在重新调整预期，因为中国央行本可以将中间价保持在7.099左右的水平(就和过去一段时间一样)，但3月22日的中间价为7.1004，接着就出现在岸汇率跌破7.2，触发了一些对冲基金的止损，可能是和期权有关。”多位外资行外汇交易员表示，一些海外对冲基金的止损盘(stop loss)被触发，导致人民币对美元短线走弱，但整体市场并不恐慌，日元近期的贬值幅度其实更大。,JPY,,2024-03-22 08:54:54,20240323
美元指数周五涨约0.4%，本周累涨约0.9%,2024-03-23 06:13:21,格隆汇3月23日｜周五（3月22日）纽约尾盘，ICE美元指数上涨0.41%，报104.430点，本周累计上涨0.96%，期间交投区间为103.172-104.496点。彭博美元指数涨0.39%，报1246.50点，本周累涨0.88%，期间交投区间为1233.07-1247.01点。美元兑日元跌0.12%，报151.44点，本周累涨1.60%，期间交投于148.91-151.86点区间。欧元兑美元跌0.48%、本周累跌0.75%，英镑兑美元跌0.45%、本周累跌1.06%，美元兑瑞郎跌0.03%、本周累涨1.55%。,JPY,,2024-03-22 22:13:21,20240323
