title,updateTimestamp,content,relatedStocks,relatedInfos,date,trade_date
美元兑日元跌破156,2024-05-15 15:39:51,格隆汇5月15日｜美元兑日元USD/JPY跌破156，日内跌0.28%。,JPY,,2024-05-15 07:39:51,20240516
,2024-05-15 20:12:38,格隆汇5月15日｜美元兑日元USD/JPY创5月1日以来最大单日跌幅，最低至155.37。,JPY,,2024-05-15 12:12:38,20240516
,2024-05-15 20:32:24,格隆汇5月15日｜美元兑日元USD/JPY日内跌幅达1.00%，现报154.84。,JPY,,2024-05-15 12:32:24,20240516
美元指数在“美国CPI发布日”跌约0.7%，纽元涨约1.4%,2024-05-16 06:21:39,格隆汇5月16日｜周三（5月15日）纽约尾盘，ICE美元指数下跌0.68%，报104.300点，逼近4月10日底部104.024点。彭博美元指数跌0.62%，报1244.39点。亚洲货币中，美元兑日元跌1.03%，报154.82。5月3日以来，已经从151.86反弹至156.74，逼近4月29日涨至的160.17。欧元兑美元涨0.56%，英镑兑美元涨0.71%，美元兑瑞郎跌0.44%；商品货币对中，澳元兑美元涨0.99%，纽元兑美元涨1.38%，美元兑加元跌0.34%。,JPY,,2024-05-15 22:21:39,20240516
日本公布弱于预期的GDP数据后 日元维持涨势,2024-05-16 08:15:49,格隆汇5月16日｜在数据显示日本第一季度GDP萎缩程度超预期后，日元兑美元维持涨势。日元兑美元涨0.4%，报154.34。,JPY,,2024-05-16 00:15:49,20240516
日韩股市、汇市双双上涨，芯片股走高,2024-05-16 08:23:29,格隆汇5月16日｜日元兑美元日内累计走高近60点，目前报154.26。韩元涨1.2%，亚市早盘中领涨亚币。日经225指数高开高走，一度涨1%。东京电子涨超4%，基恩士涨超3%，索尼、迅销、软银集团、任天堂涨超1%。韩国首尔综合指数开盘涨1.5%，目前涨1.2%。SK海力士涨近4%，三星电子涨超2%。昨日美国CPI数据重燃降息预期。日本一季度实际GDP年化季环比初值下降2%，预估下降1.2%。,JPY,,2024-05-16 00:23:29,20240516
中信证券：日本有可能再度入场支持日元 短期或不宜再追空日元,2024-05-16 08:28:19,格隆汇5月16日｜中信证券研报表示，日元今年以来弱于多种主流货币，近期明显承压，其贬值基础源于日本央行持续偏鸽的货币政策立场。日本近期稳汇率的压力似乎比许多亚洲新兴经济体还更严峻，日本当局或已在“黄金周”期间两度干预外汇，但上周日元再度转弱。日元贬值并非总是利好日本经济，日本出口数量未因此而明显增加，日元快速贬值不利于居民实际收入及购买力的修复，且或会在短期降低日元资产的国际吸引力。我们认为日本有可能再度入场支持日元，日银年内还将加息两次至0.5%左右，应关注美国通胀走势对美日汇率的影响，短期或不宜再追空日元。,JPY,,2024-05-16 00:28:19,20240516
美元兑日元回落至154下方,2024-05-16 08:34:38,格隆汇5月16日｜美元兑日元USD/JPY回落至154下方，日内跌0.57%。,JPY,,2024-05-16 00:34:38,20240516
