title,updateTimestamp,content,relatedStocks,relatedInfos,date,trade_date
日元盘整，交易商仍对可能的外汇干预保持警惕,2024-04-26 09:44:19,格隆汇4月26日｜由于交易商对日本当局可能采取的外汇干预措施保持警惕，日元兑其他十国集团和亚洲货币汇率盘整。日本财务大臣铃木俊一今早表示，日本财务省正在仔细观察货币市场，并将采取一切可能的应对措施。CBA国际和可持续经济部门主管Joseph Capurso在报告中说，如果日元在日本央行今天的会议结果公布后出现实质性疲软，日本当局可能会采取干预措施来回击市场，这种干预可能会大幅拉低澳元和其他货币兑日元的汇率。美元兑日元USD/JPY现报155.59。,JPY,,2024-04-26 01:44:19,20240427
日本财务大臣铃木俊一：对日元疲软给通胀带来的影响感到担忧,2024-04-26 10:18:07,格隆汇4月26日｜日本财务大臣铃木俊一称，在政府试图应对通胀之际，他担心日元疲软带来的负面影响。铃木俊一周五在东京表示，虽然日元贬值有利有弊，但鉴于控制通胀是一项关键政策，对其负面影响感到担忧他表示，正密切关注汇率走势，将根据他的观察采取一切可能措施。无法评论是否需要采取行动解决日元疲软问题。准备好在必要时采取一切可用措施应对汇率问题。,JPY,,2024-04-26 02:18:07,20240427
历史经验表明即使在日本央行开会期间 日本当局也有过汇市干预,2024-04-26 10:32:54,格隆汇4月26日｜历史经验表明，日本当局甚至在央行货币政策委员会开会期间，也愿意干预汇市。 日本财务省数据显示，2003年到2004年，在日本央行九次政策会议期间，日本外汇当局至少有一天卖出日元买入美元。1999年、2000年和2002年时，当局在日本央行开会时也分别进行过一次此类干预。日本曾在1998年4月9日和2022年9月22日央行开会期间，入市买入日元卖出美元。日本的外汇政策由财务省制定，虽然官员不希望采取与日本央行货币政策相悖的市场行动，但不会因为政策委员会正在开会讨论而不去下令干预汇市。,JPY,,2024-04-26 02:32:54,20240427
按兵不动！日本央行将基准利率维持在0-0.1%,2024-04-26 11:22:46,格隆汇4月26日｜日本央行按兵不动，将基准利率维持在0-0.1%，符合市场预期。日本央行预计2024财年核心CPI为2.8%，此前预期为2.4%。央行在声明中删除了目前每月购买约6万亿日元公债的说法，将按照2024年3月的决定购买债券。,JPY,,2024-04-26 03:22:46,20240427
日元兑美元一度跌至155.89，触及34年新低,2024-04-26 11:26:33,格隆汇4月26日｜日本央行如期维持利率不变，日元兑美元一度跌至155.89，触及34年新低。,JPY,,2024-04-26 03:26:33,20240427
日本央行：预计目前宽松的金融环境将持续,2024-04-26 11:30:08,格隆汇4月26日｜日本央行表示，预计目前宽松的金融环境将持续，必须适当关注金融和外汇市场。基础通胀可能会逐步上升，接近日本央行的物价目标。基础通胀可能会逐步上升，接近日本央行的物价目标。,JPY,,2024-04-26 03:30:08,20240427
日本央行按兵不动！日股涨1% 日元兑美元跌破156,2024-04-26 11:35:03,格隆汇4月26日｜日经225指数涨幅扩大至1%，日元兑美元跌破156，创34年新低。消息面上，日本央行将基准利率维持在0-0.1%，符合市场预期。日本央行在声明中删除了目前每月购买约6万亿日元公债的说法。,JPY,,2024-04-26 03:35:03,20240427
,2024-04-26 11:39:26,格隆汇4月26日｜财经网站Forexlive分析师Adam Button：利率决议公布后，美元兑日元USD/JPY从之前的155.55日元升破156，创下了34年来的新低。我认为这是由于在利率方面缺乏任何行动或强烈的行动暗示。,JPY,,2024-04-26 03:39:26,20240427
,2024-04-26 11:41:02,格隆汇4月26日｜欧元兑日元在日本央行利率决定公布后升至167.38，为2008年以来的最高水平；澳元兑日元升至2014年以来高位，报101.78。,JPY,,2024-04-26 03:41:02,20240427
,2024-04-26 11:45:46,格隆汇4月26日｜分析师Mark Cranfield：由于日本央行没有威胁要更加积极地收紧政策，这对美元/日元有利，日经225指数期货重新焕发活力。,JPY,,2024-04-26 03:45:46,20240427
分析师：日元干预行动交由日本外务省决定 美盘或出现大幅波动,2024-04-26 14:49:06,格隆汇4月26日｜分析师Mark Cranfield：交易员们会注意到，日本央行今天错过了对日元疲软采取任何行动的机会，因此下一步干预行动（如果有的话）将由日本外务省决定。如果日本当局认为时机成熟，周五美盘市场通常会出现大幅波动。尽管期权定价表明，交易员已经为这种结果做好了准备。,JPY,,2024-04-26 06:49:06,20240427
分析师：日元汇率不是植田和男的目标,2024-04-26 15:28:11,格隆汇4月26日｜分析师Gearoid Reidy：鉴于市场对上个月加息决定的反应，我本以为植田和男会采取更加鹰派的基调。几个月来，大多数人都预期加息决定将标志着日元疲软趋势的逆转，但该行上个月对未来加息的鸽派基调，以及美联储推迟降息，意味着事情恰恰相反。植田和男今天本有机会发表更加鹰派的言论，但到目前为止，他的言论还比较中性。这是有道理的，日元不是他的目标，而且他说日元汇率对通胀的影响不大。,JPY,,2024-04-26 07:28:11,20240427
分析师：今晚美国PCE数据公布后日元干预风险或加大,2024-04-26 15:57:19,格隆汇4月26日｜分析师Beth Thomas表示，在日本央行行长植田和男发表讲话时，日元继续下跌，兑美元接近157，这加剧了有关当局可能在今天晚些时候干预市场的猜测。周五晚些时候，美联储青睐的通胀指标将公布，届时风险将进一步加大，交易商将高度警惕日元的任何回调。,JPY,,2024-04-26 07:57:19,20240427
日本央行如预期按兵不动 日元大幅震荡,2024-04-26 16:50:59,格隆汇4月26日｜日本央行在为期两天的政策会议结束时维持利率不变，同时简化了购债和政策措辞，推动日元跌至34年新低。日本央行维持利率不变，符合市场普遍预期。按兵不动的决定及最新经济预测未给日元带来多少支撑。日元兑美元自1990年以来首次跌破156关口。行长植田和男在会后新闻发布会上表示，虽然汇率可能是影响通胀的一个重要因素，但日元疲软尚未对潜在价格趋势产生重大影响。植田和男这番表态后，日元兑美元应声跌至盘中低点156.82。之后日元出现大幅震荡，一度由跌转涨，短暂跳升至154.99。投资者对日元可能出现的任何快速反弹都保持高度警惕。他们同时担心，日本当局可能不会证实进行干预，过去的一些极端反弹案例曾被归因于算法交易。,JPY,,2024-04-26 08:50:59,20240427
日本央行未提供支撑 日元面临进一步贬值压力,2024-04-26 19:29:21,格隆汇4月26日｜如果日本不尽快干预外汇市场，它将开始面临国际社会强烈反对的风险。本月，日本财务大臣铃木俊一向美财长耶伦表达了对日元大幅贬值的严重担忧后，你可能预计日本央行会给日元提供一点支撑。但今天没有发生这种情况。日本央行行长植田和男坚持认为，日元能够继续通过提振需求而提振经济，其对潜在通胀趋势的影响仍然可以忽略不计。这将导致日元进一步疲软，使得焦虑的外汇交易员反应过度；而对那些将现金储存在海外资产中的日本投资者来说，这将使他们获得更多利润，并有可能使出口商提升其底线。,JPY,,2024-04-26 11:29:21,20240427
加皇银行：美日利率差异令日元承压,2024-04-26 19:47:30,格隆汇4月26日｜加拿大皇家银行首席投资长Mark Dowding表示，在日本央行早些时候召开政策会议之后，日元面临的抛售压力加大，因为美日两国之间的巨大利差令日元承压。这种利率差距“继续削弱日元”。且由于美国无法降息，日本收紧货币政策以缓解日元疲软的压力越来越大。日本央行今日维持其政策不变，导致日元兑美元在欧盘时段续刷34年来的新低。,JPY,,2024-04-26 11:47:30,20240427
分析师：尽管干预风险加大，但日元持续下行趋势未受影响,2024-04-26 19:47:55,格隆汇4月26日｜Oanda高级市场分析师Kelvin Wong表示，尽管外汇干预风险不断加大，但日元的持续下行趋势并未受到影响。早些时候公布的东京4月份核心通胀率为1.8%，是自2022年9月以来消费者价格上涨的最慢速度，低于日本央行2%的通胀目标，这可能会推迟日本央行下一次加息的时间。此外，Wong补充称，近期美国国债与日本国债的利差扩大，预计将支持美元兑日元进一步走强。,JPY,,2024-04-26 11:47:55,20240427
非美货币普遍走高,2024-04-26 20:35:19,格隆汇4月26日｜欧元兑美元EUR/USD短线走高24点，英镑兑美元GBP/USD短线走高31点，美元兑日元USD/JPY短线走低37点。,JPY,,2024-04-26 12:35:19,20240427
日元对美元汇率一度跌至156.95,2024-04-26 22:13:07,格隆汇4月26日｜据日本时事通信社，当天的纽约外汇市场上，日元对美元汇率一度跌至156.95日元兑换1美元。,JPY,,2024-04-26 14:13:07,20240427
美元兑日元站上157关口,2024-04-26 22:38:12,格隆汇4月26日｜美元兑日元USD/JPY震荡上行，站上157关口，为1990年5月来首次，日内涨0.9%。,JPY,,2024-04-26 14:38:12,20240427
日元兑美元跌破157日元 加剧日本当局干预风险,2024-04-26 23:16:31,"格隆汇4月26日｜日本央行行长植田和男暗示货币政策将保持宽松之后，日元兑美元跌至34年新低，跌破了157日元关口，加剧了对日本当局可能很快就干预市场以遏制日元跌势的猜测。日元在纽约交易时段一度下跌1.1%，触及盘中低点157.29日元兑1美元。日元兑美元今年以来已经贬值了10%，在G-10货币中表现最差。推动其贬值的主要因素是美国与日本之间的巨大利差，美联储去年激进加息之后美国利率处于数十年高点，而日本利率仍顽固保持在零附近。“这是令人难以置信的疲软,”” St James Place Management首席投资官Justin Onuekwusi说。“这种程度的疲软肯定会引起担忧。我们认为日元已经走得太远。”“日本央行再一次证明，其鸽派程度可以让华尔街最鸽派的预期都相形见绌，” Saxo Capital Markets策略师Charu Chanana说。“我们又回到了等待干预来阻止日元暴跌的状态。但任何干预，如果没有协调一致的行动以及鹰派政策信息的支持，都将是徒劳的。”",JPY,,2024-04-26 15:16:31,20240427
日元跌至接近158,2024-04-27 00:41:24,格隆汇4月27日｜日元汇价周五在美国纽约汇市失守157兑每美元水平，为1990年5月10日以来首度跌穿157关口，低位暂时触及157.74，跌幅达到1.34%。今年初以来，日元累计急跌超过11%。日本央行行长植田和男称，外汇对日本经济的影响包含正面因素，弱势日元对需求有正面影响。,JPY,,2024-04-26 16:41:24,20240427
美国CFTC：日本央行4月政策会议开幕前，日元空单创历史新高,2024-04-27 06:19:52,"格隆汇4月27日｜美国商品期货交易委员会（CFTC）持仓周报显示：4月23日当周，交易员们（含对冲基金和资产管理公司）所持日元空头合约超过184,180手，打破之前一周所创（2006年有数据记录以来的）历史最高。",JPY,,2024-04-26 22:19:52,20240427
日元狂跌至158下方，植田和男称无意救市,2024-04-27 06:20:54,格隆汇4月27日｜美元兑日元突破158，日内涨幅1.7%，报158.33，日本央行行长植田和男明确表态“无意拯救疲软日元”当天，直接从156下方狂飙至158上方，续创1990年来新低。值得一提的是，本周稍早，前美国总统特朗普已经针对日元贬值表达不满情绪。,JPY,,2024-04-26 22:20:54,20240427
美指在“美国PCE通胀指标发布日”涨约0.5%，日元本周跌约2.4%逼近159,2024-04-27 06:23:08,格隆汇4月27日｜周五（4月26日）纽约尾盘，ICE美元指数上涨0.47%，报106.093点，本周累计下跌0.06%。彭博美元指数涨0.26%，报1263.43点，本周累计下跌0.07%。亚洲货币中，美元兑日元涨1.73%，报158.34点，本周累计上涨2.39%，交投区间为154.46-158.44点。欧元兑美元跌0.34%、本周累涨0.35%，英镑兑美元跌0.16%、本周累涨1%，美元兑瑞郎涨0.25%、本周累涨0.46%；商品货币对中，澳元兑美元涨0.23%、本周累涨1.79%，纽元兑美元跌0.14%、本周累涨0.88%，美元兑加元涨0.09%、本周累跌0.59%。,JPY,,2024-04-26 22:23:08,20240427
