title,updateTimestamp,content,relatedStocks,relatedInfos,date,trade_date
,2024-05-30 10:34:46,格隆汇5月30日｜野村证券将美元兑日元年底预测从145上调至148。,JPY,,2024-05-30 02:34:46,20240531
美银：日本企业海外并购可能推动美/日升至160以上,2024-05-30 16:21:48,格隆汇5月30日｜美国银行分析师Shusuke Yamada在研究报告中称，日本企业海外并购欲望增加可能会将美元兑日元USD/JPY推高至160以上。并购流动会导致目标国货币相对于收购国货币（即日本）走强。该分析师认为，随着日本公司加大海外并购力度，美/日在9月底将达到161，而之前预测为157。他补充说，今年宣布并购的速度是2019年以来最快的。,JPY,,2024-05-30 08:21:48,20240531
美元兑日元短线下挫,2024-05-30 21:15:51,格隆汇5月30日｜美元兑日元USD/JPY短线下挫近30点，现报156.47。,JPY,,2024-05-30 13:15:51,20240531
ICE美元指数跌超0.3%，瑞郎涨约1.1%,2024-05-31 06:28:42,"格隆汇5月31日｜周四（5月30日）纽约尾盘，ICE美元指数跌0.35%，报104.749点，日内交投区间为105.184-104.632点。彭博美元指数跌0.23%，报1252.18点，日内交投区间为1256.59-1250.52点。
亚洲货币中，美元兑日元跌0.55%，报156.77，盘中交投于157.67-156.38。欧元兑美元涨0.29%，英镑兑美元涨0.25%，美元兑瑞郎跌1.08%；商品货币对中，澳元兑美元涨0.34%，纽元兑美元持平，美元兑加元跌0.27%。",JPY,,2024-05-30 22:28:42,20240531
