title,updateTimestamp,content,relatedStocks,relatedInfos,date,trade_date
,2024-05-09 09:37:16,格隆汇5月9日｜财经网站Forexlive分析师：日本方面进行了更多的口头干预，今天到目前为止，美元兑日元保持在155.70以下。,JPY,,2024-05-09 01:37:16,20240510
日本央行委员们密切关注日元对通胀影响 也预期可能会更快速升息,2024-05-09 10:24:04,格隆汇5月9日｜日本央行4月政策会议的意见摘要显示，委员们密切关注日元疲软对通胀的影响，并预期因此可能更快升息。根据周四发布的4月25-26日政策会议的意见摘要，九名委员之一表示：“在日元走弱的背景下，如果潜在通胀继续攀升偏离基准情景，货币政策正常化的步伐很可能会加快。”另一位委员指出，由于日元贬值和高油价，“物价向上偏离基准情境的风险值得关注”。,JPY,,2024-05-09 02:24:04,20240510
韩元下跌 受美联储利率不确定性和日元疲软影响,2024-05-09 10:58:46,"格隆汇5月9日｜由于围绕美联储降息前景的不确定性继续存在，韩元连续第二天走软。美元/韩元上涨0.4%至1,368.15韩元；周三上涨0.2%。",JPY,,2024-05-09 02:58:46,20240510
美国公布初请数据后 非美货币普涨,2024-05-09 20:36:25,格隆汇5月9日｜欧元兑美元EUR/USD短线上扬20点，报1.0751；英镑兑美元GBP/USD短线上扬30点，报1.2501；美元兑日元USD/JPY短线下挫20点，报155.69。,JPY,,2024-05-09 12:36:25,20240510
高盛策略师：美国利率长期高企将对瑞典克朗、澳元和加元冲击最大,2024-05-09 23:27:04,格隆汇5月9日｜高盛策略师表示，瑞典克朗、澳元和加元最容易受到美国利率长期处于高位的影响。他们表示，像日元一样，这些货币兑美元自4月份以来也受到重大冲击，因为随着对美国降息预期推迟，实际利率曲线趋陡。宏观策略师Isabella Rosenberg在报告中写道，这三种货币“对国内消费的政策传导率都很高，这可能意味着对相对政策的变化更加敏感”。,JPY,,2024-05-09 15:27:04,20240510
小摩分析师：日元干预水平将在160附近 ,2024-05-09 23:40:49,格隆汇5月9日｜摩根大通全球市场策略师David Lebovitz表示，如果日元兑美元继续下滑，可能导致通胀预期不稳定。他表示：“市场暗示，160可能是一个神奇的水平，有关方面不希望看到日元在这个水平之上走弱。”“我认为，到160的时候，你会看到更多关于干预可能性的声音。”Lebovitz表示，日元走软有助于日本经济的通胀。不过虽然日本的消费价格增长是由日元贬值推动的，但如果日元继续贬值，“弊大于利”。今年早些时候我们看到的加息更多的是上限的一个提示，而不是朝着大幅收紧货币政策迈出的一步。,JPY,,2024-05-09 15:40:49,20240510
美元指数跌0.3%，日元下探156,2024-05-10 06:25:35,"格隆汇5月10日｜周四（5月9日）纽约尾盘，ICE美元指数下跌0.30%，报105.228点，北京时间19:45（英国央行利率决议声明发布后、行长贝利新闻发布会开始之后）涨至日高105.742点，20:30发布美国每周就业数据时显著跳水，03:41跌至日低105.208点。彭博美元指数跌0.29%，报152.84点，日内交投区间为1258.61-1252.76点。
亚洲货币中，美元兑日元跌0.03%，报155.48，日本财务省外汇事务主管神田真人与日本央行行长植田和男评论日元汇率和日本当局干预汇市之际，在08:07跳水至日低155.17，17:57涨至日高155.95，全天大部分时间处于上涨状态。
欧元兑美元上涨0.31%在美国就业数据发布后显著反弹，英镑兑美元涨0.20%报1.2524、英国央行决议声明发布后显著跳水至日低1.2446，美元兑瑞郎跌0.20%；商品货币对中，澳元兑美元涨0.60%，纽元兑美元涨0.47%，美元兑加元跌0.32%。",JPY,,2024-05-09 22:25:35,20240510
