title,updateTimestamp,content,relatedStocks,relatedInfos,date,trade_date
日本实施最大规模外汇干预，市场反应冷淡,2024-06-04 09:02:23,"格隆汇6月4日｜据日经中文网，5月31日，日本财务省公布4月26日至5月29日的外汇干预实际情况。干预总额为9.7885万亿日元。这反映了疑似4月29日和5月2日实施的买入日元、卖出美元的干预措施，是自2022年10月以来的再次干预。与过去日元贬值局面下的干预相比，此次的规模创出历史新高。
此次是并未在干预后立即宣布实施的秘密干预。有分析认为这是日本的单独干预。2022年9月22日，日本时隔23年首次买入日元进行干预，时任财务相铃木俊一在记者会上公布了相关消息。
此次干预对汇率行情生产了一定的影响。在5月31日的东京外汇市场，徘徊在1美元兑157日元左右，比4月29日创出的160日元升值3日元左右。
瑞穗证券的首席市场经济学家上野泰也指出，外汇干预“只是在拖延时间”。日本银行（央行）在3月解除负利率后，政策利率依然很低，与结束大幅加息的海外相比依然存在利率差，因此日元也依然容易被抛售。",JPY,['日本经济'],2024-06-04 01:02:23,20240605
“历史性日元贬值”没那么容易扭转,2024-06-04 09:05:53,格隆汇6月4日｜据日经中文网，日元汇率跌破1美元兑150日元关口的历史性日元贬值局面在持续。主要原因是日美之间的利率差，但背后的贸易等供求因素带来的卖出日元的影响也不容忽视。只要资金从日本流向海外的结构不改变，即使利率差缩小，也难以从日元贬值趋势中实现根本性转变。,JPY,['日本经济'],2024-06-04 01:05:53,20240605
日本财务大臣首次证实干预日元 肯定干预效果 ,2024-06-04 09:57:07,格隆汇6月4日｜日本财务大臣铃木俊一说，日本政府一个多月前对外汇市场的干预在一定程度上是有效的。这是日本财务大臣首次正式承认政府干预汇市的行动。此前，日本方面披露的数据显示日本政府为支撑日元花费了创纪录的资金。铃木俊一周二对记者表示：“我们对市场进行干预，以遏制由投机驱动的过度外汇波动。”“从这个角度来看，我们认为它有一定的影响。”日本官员此前倾向于保持沉默，不说明他们是否会在日元大幅波动后立即入市，这是他们让市场参与者保持猜测的策略之一，这可能会让交易员对推动汇率突破关键关口更加谨慎。,JPY,,2024-06-04 01:57:07,20240605
,2024-06-04 14:20:55,格隆汇6月4日｜美元兑日元USD/JPY短线持续走低，最低至155.80，再创5月20日以来新低。,JPY,,2024-06-04 06:20:55,20240605
,2024-06-04 18:13:58,格隆汇6月4日｜美元兑日元USD/JPY失守155，为5月16日来新低，日内跌幅0.69%。,JPY,,2024-06-04 10:13:58,20240605
机构：如果数据显示美国经济开始减弱，日元将扩大涨幅,2024-06-04 20:32:57,格隆汇6月4日｜Pepperstone 研究主管Chris Weston在报告中称，如果进一步的数据显示美国经济实力开始减弱，日元可能会延续近期的涨势。在疲软的美国ISM制造业数据公布后，美元周一全线大跌，兑日元跌至两周低点154.704。“这是美国经济例外论主题受到质疑的一天，美国ISM制造业报告引发了一些人对美国经济增长轨迹的担忧。”,JPY,,2024-06-04 12:32:57,20240605
美元指数冲高回落，日元涨穿155,2024-06-05 06:24:36,格隆汇6月5日｜周二（6月4日）纽约尾盘，ICE美元指数大致持平，报104.143点，日内交投区间为104.333-103.993点。彭博美元指数涨0.06%，报1252.41点，日内交投区间为1255.59-1249.65点。亚洲货币中，美元兑日元跌0.78%，报154.86，盘中交投区间为156.49-154.55。,JPY,,2024-06-04 22:24:36,20240605
