title,updateTimestamp,content,relatedStocks,relatedInfos,date,trade_date
,2024-06-18 09:51:06,格隆汇6月18日｜美元兑日元USD/JPY小幅走高，现报157.55。,JPY,,2024-06-18 01:51:06,20240619
瑞银：美联储降息前日元或继续贬值 预计日元跌至160 ,2024-06-18 12:42:53,格隆汇6月18日｜瑞银全球财富管理表示，在美联储开始降息之前，日元仍有贬值空间。该行首席投资官Kelvin Tay表示，从短期来看，我们确实认为美日可能会再次触及160的水平，我不认为日本央行会在这个时间点上急于加息。而如果美联储在9月份不降息，进一步推迟降息，那么很明显，美国国债与日本国债之间的收益率差距实际上会进一步扩大，而美日国债收益率之差仍然是日元的一个关键压力点。,JPY,,2024-06-18 04:42:53,20240619
,2024-06-18 15:21:20,格隆汇6月18日｜美元兑日元USD/JPY突破158，日内涨0.20%。,JPY,,2024-06-18 07:21:20,20240619
,2024-06-18 20:33:23,格隆汇6月18日｜欧元兑美元EUR/USD、英镑兑美元GBP/USD短线上涨20点，美元兑日元USD/JPY短线下挫近30点。,JPY,,2024-06-18 12:33:23,20240619
,2024-06-19 07:59:06,格隆汇6月19日｜日本央行会议纪要显示，多位委员表示，如果价格走势上升，将调整宽松程度。一名委员表示由于日元的走势，加快正常化步伐成为可能。,JPY,,2024-06-18 23:59:06,20240619
